{
  "schemaVersion": "2.0.0",
  "id": "horseshoe",
  "name": "Horseshoe Spread",
  "summary": "A seven-card curved arch providing balanced insight into obstacles, hidden factors, and tactical approach.",
  "layoutType": "linear",
  "difficulty": "intermediate",
  "author": "Traditional",
  "license": "CC-BY-4.0",
  "tags": ["arch", "problem-solving", "clarity", "seven-card"],
  "instructions": {
    "preparation": "Visualize your question as an archway through which you must pass.",
    "shuffle": "Shuffle the full deck while concentrating on clearing away ambiguity.",
    "drawing": "Deal 7 cards in a semi-circular U-shape starting bottom-left, ascending to apex, and descending right.",
    "synthesis": "Compare the ascent (Cards 1-3) with the pivot (Card 4) and descent/emergence (Cards 5-7)."
  },
  "deckContract": {
    "minCards": 7,
    "deckType": "full_78",
    "allowReversals": true,
    "requiresSignificator": false
  },
  "slots": [
    {
      "id": "past",
      "order": 1,
      "role": "Past Influences",
      "description": "Historical factors that originated the present dilemma.",
      "layout": { "x": 0.15, "y": 0.75, "rotation": -25, "zIndex": 0 }
    },
    {
      "id": "present",
      "order": 2,
      "role": "Present Status",
      "description": "Where you stand at this exact moment.",
      "layout": { "x": 0.22, "y": 0.45, "rotation": -15, "zIndex": 0 }
    },
    {
      "id": "hidden-influences",
      "order": 3,
      "role": "Hidden Influences",
      "description": "Unseen forces, unexamined variables, or latent dynamics.",
      "layout": { "x": 0.35, "y": 0.25, "rotation": -5, "zIndex": 0 }
    },
    {
      "id": "obstacle",
      "order": 4,
      "role": "The Pivot / Obstacle",
      "description": "The crux of the matter: what must be faced or transformed.",
      "layout": { "x": 0.5, "y": 0.18, "rotation": 0, "zIndex": 0 }
    },
    {
      "id": "external-attitudes",
      "order": 5,
      "role": "External Attitudes",
      "description": "How the surrounding world and key peers perceive the issue.",
      "layout": { "x": 0.65, "y": 0.25, "rotation": 5, "zIndex": 0 }
    },
    {
      "id": "best-approach",
      "order": 6,
      "role": "Optimal Action / Advice",
      "description": "The most effective psychological or practical response to adopt.",
      "layout": { "x": 0.78, "y": 0.45, "rotation": 15, "zIndex": 0 }
    },
    {
      "id": "probable-outcome",
      "order": 7,
      "role": "Probable Outcome",
      "description": "The destination reached if the recommended approach is taken.",
      "layout": { "x": 0.85, "y": 0.75, "rotation": 25, "zIndex": 0 }
    }
  ],
  "relations": [
    {
      "source": "past",
      "target": "present",
      "type": "leads_to",
      "label": "Direct Continuity"
    },
    {
      "source": "hidden-influences",
      "target": "obstacle",
      "type": "clarifies",
      "label": "Roots of the Hurdle"
    },
    {
      "source": "obstacle",
      "target": "best-approach",
      "type": "opposes",
      "label": "Friction to Resolution"
    },
    {
      "source": "best-approach",
      "target": "probable-outcome",
      "type": "culminates_in",
      "label": "Yields Outcome"
    }
  ]
}
